{
  "schema_version": "1.0",
  "id": "880e8400-e29b-41d4-a716-446655440003",
  "device_id": "550e8400-e29b-41d4-a716-446655440000",
  "profile_id": "660e8400-e29b-41d4-a716-446655440001",
  "content": "Le encanta la pasta al pesto. Pide receta fácil los martes.",
  "summary": "Prefiere pasta al pesto, recetas fáciles los martes",
  "category": "preference",
  "importance": 3,
  "source": "conversation",
  "tags": ["cocina", "recetas", "pasta"],
  "created_at": "2025-08-20T14:35:00Z",
  "expires_at": null,
  "deleted_at": null
}
